{
  "schema_version": 1,
  "id": "993m2se0ht",
  "type": "book",
  "title": "[江蘇常州]蔣灣橋周氏續修宗譜",
  "work_id": "d59fy35m36kg",
  "edition": "清光緒十七年愛蓮堂木活字印本",
  "edition_type": "活字本",
  "juan_count": {
    "number": 12,
    "unit": "卷"
  },
  "measure_info": "十二卷",
  "publication_info": {
    "year": "1891",
    "details": "刊刻者：愛蓮堂"
  },
  "provenance": [
    {
      "institution": "日本國會圖書館",
      "call_number": "",
      "seals": [],
      "notes": "",
      "source": "中國古籍總目 item/1bbufbl40plsx1zb"
    }
  ],
  "indexed_by": [
    {
      "source": "中國古籍總目",
      "source_bid": "1exjosng9241s",
      "title_info": "[江蘇常州]蔣灣橋周氏續修宗譜十二卷",
      "summary": "[江蘇常州]蔣灣橋周氏續修宗譜十二卷｜清周濟棠等纂修｜清光緒十七年愛蓮堂木活字印本｜日本國會圖書館"
    }
  ],
  "sources": [
    {
      "id": "8jeaiw8w5innihml",
      "name": "中國古籍總目（上圖聯合目錄）",
      "type": "url",
      "details": "https://gj.library.sh.cn/unionCatalogue/work/list#uri=http://data.library.sh.cn/gj/resource/instance/8jeaiw8w5innihml&from=evidence"
    }
  ],
  "ai_note": "F 道（overview#576）據《中國古籍總目》（上圖聯合目錄）自動錄入；源記錄：8jeaiw8w5innihml",
  "revision": "1.0.0",
  "revised_at": "2026-10-18"
}
