{
  "schema_version": 1,
  "id": "994obl1o1s",
  "type": "book",
  "title": "古厤",
  "work_id": "d59fz5bhjv29",
  "edition": "",
  "juan_count": {
    "number": 1,
    "unit": "冊"
  },
  "measure_info": "一冊",
  "provenance": [
    {
      "institution": "浙江圖書館",
      "call_number": "",
      "seals": [],
      "notes": "",
      "source": "中國古籍總目 item/djus8o7rwu77qu8o"
    }
  ],
  "indexed_by": [
    {
      "source": "中國古籍總目",
      "source_bid": "d59frnrt4lxc",
      "title_info": "古厤一冊",
      "summary": "古厤一冊｜｜｜浙江圖書館"
    }
  ],
  "sources": [
    {
      "id": "7q24rfo7oc2vnyik",
      "name": "中國古籍總目（上圖聯合目錄）",
      "type": "url",
      "details": "https://gj.library.sh.cn/unionCatalogue/work/list#uri=http://data.library.sh.cn/gj/resource/instance/7q24rfo7oc2vnyik&from=evidence"
    }
  ],
  "ai_note": "【叢書子目新建·未比对到单行本】叢書线（GUJI-526）據《中國古籍總目》（上圖聯合目錄）自動錄入；源記錄：7q24rfo7oc2vnyik",
  "contained_in": [
    {
      "id": "8rldozmnebk0"
    }
  ],
  "revision": "1.0.0",
  "revised_at": "2026-10-20"
}
