{
  "schema_version": 1,
  "id": "993aarqxoi",
  "type": "book",
  "title": "孝經彙目",
  "work_id": "d59fxra8c0zm",
  "edition": "孝經大全十集本",
  "juan_count": {
    "number": 1,
    "unit": "卷"
  },
  "measure_info": "一卷",
  "indexed_by": [
    {
      "source": "中國古籍總目",
      "source_bid": "1exjosng9241s",
      "title_info": "孝經彙目一卷",
      "summary": "孝經彙目一卷｜明江元祚輯｜孝經大全十集本｜"
    }
  ],
  "sources": [
    {
      "id": "jfj4rhlsco520r50",
      "name": "中國古籍總目（上圖聯合目錄）",
      "type": "url",
      "details": "https://gj.library.sh.cn/unionCatalogue/work/list#uri=http://data.library.sh.cn/gj/resource/instance/jfj4rhlsco520r50&from=evidence"
    }
  ],
  "ai_note": "F 道（overview#576）據《中國古籍總目》（上圖聯合目錄）自動錄入；源記錄：jfj4rhlsco520r50\n總目未載館藏",
  "revision": "1.0.0",
  "revised_at": "2026-10-18"
}
