{
  "schema_version": 1,
  "id": "9953ghmvb4",
  "type": "book",
  "title": "精神之敎育",
  "work_id": "d59fxxhzaww0",
  "edition": "清光緒二十八年上海廣智書局鉛印本",
  "edition_type": "鉛印本",
  "juan_count": {
    "number": 1,
    "unit": "卷"
  },
  "measure_info": "一卷",
  "publication_info": {
    "year": "1902",
    "details": "刊刻者：上海廣智書局"
  },
  "authors": [
    {
      "name": "隅谷乙三郎",
      "role": "撰",
      "dynasty": "日本",
      "entity_id": "hixi8us1ybf5"
    },
    {
      "name": "趙必振",
      "role": "譯",
      "dynasty": "清",
      "entity_id": "hixi8us2ksi0"
    }
  ],
  "provenance": [
    {
      "institution": "天津圖書館",
      "call_number": "",
      "seals": [],
      "notes": "",
      "source": "中國古籍總目 item/j6qbmjnsg5ygncbm"
    }
  ],
  "indexed_by": [
    {
      "source": "中國古籍總目",
      "source_bid": "d59frnrt4lxc",
      "title_info": "精神之敎育一卷",
      "summary": "精神之敎育一卷｜日本隅谷乙三郎撰;清趙必振譯｜清光緒二十八年上海廣智書局鉛印本｜天津圖書館"
    }
  ],
  "sources": [
    {
      "id": "s2ypr5524fr54lqr",
      "name": "中國古籍總目（上圖聯合目錄）",
      "type": "url",
      "details": "https://gj.library.sh.cn/unionCatalogue/work/list#uri=http://data.library.sh.cn/gj/resource/instance/s2ypr5524fr54lqr&from=evidence"
    }
  ],
  "ai_note": "G 道（overview#576）據《中國古籍總目》（上圖聯合目錄）自動錄入；源記錄：s2ypr5524fr54lqr",
  "revision": "1.0.0",
  "revised_at": "2026-10-21"
}
