{
  "schema_version": 1,
  "id": "994awqhiww",
  "type": "book",
  "title": "史通贅議",
  "work_id": "d59fyrlby9ky",
  "edition": "民國二十三年鉛印本",
  "edition_type": "鉛印本",
  "juan_count": {
    "number": 8,
    "unit": "卷"
  },
  "measure_info": "八卷",
  "publication_info": {
    "year": "1934"
  },
  "provenance": [
    {
      "institution": "吉林省圖書館",
      "call_number": "",
      "seals": [],
      "notes": "",
      "source": "中國古籍總目 item/22ydhbid38wts1cy"
    },
    {
      "institution": "上海圖書館",
      "call_number": "",
      "seals": [],
      "notes": "",
      "source": "中國古籍總目 item/qioafxmixhrgibws"
    }
  ],
  "indexed_by": [
    {
      "source": "中國古籍總目",
      "source_bid": "1exjosng9241s",
      "title_info": "史通贅議八卷",
      "summary": "史通贅議八卷｜許鍾璐撰｜民國二十三年鉛印本｜吉林省圖書館、上海圖書館"
    }
  ],
  "sources": [
    {
      "id": "z5mn5ugs4tivb8b1",
      "name": "中國古籍總目（上圖聯合目錄）",
      "type": "url",
      "details": "https://gj.library.sh.cn/unionCatalogue/work/list#uri=http://data.library.sh.cn/gj/resource/instance/z5mn5ugs4tivb8b1&from=evidence"
    }
  ],
  "ai_note": "F 道（overview#576）據《中國古籍總目》（上圖聯合目錄）自動錄入；源記錄：z5mn5ugs4tivb8b1",
  "revision": "1.0.0",
  "revised_at": "2026-10-20"
}
