{
  "schema_version": 1,
  "id": "98y36xt3pd",
  "type": "book",
  "title": "遼詩話",
  "work_id": "d59f2ns47vuo",
  "edition": "述古叢抄本",
  "edition_type": "抄本",
  "juan_count": {
    "number": 2,
    "unit": "卷"
  },
  "measure_info": "二卷",
  "indexed_by": [
    {
      "source": "中國古籍總目",
      "source_bid": "d59frnrt4lxc",
      "title_info": "遼詩話二卷",
      "summary": "遼詩話二卷｜清周春撰｜述古叢抄本｜"
    }
  ],
  "sources": [
    {
      "id": "woe5kdlaxuixbuhe",
      "name": "中國古籍總目（上圖聯合目錄）",
      "type": "url",
      "details": "https://gj.library.sh.cn/unionCatalogue/work/list#uri=http://data.library.sh.cn/gj/resource/instance/woe5kdlaxuixbuhe&from=evidence"
    }
  ],
  "ai_note": "E 道（overview#409）據《中國古籍總目》（上圖聯合目錄）自動錄入；源記錄：woe5kdlaxuixbuhe\n總目未載館藏",
  "revision": "1.0.0",
  "revised_at": "2026-10-09"
}
