{
  "schema_version": 1,
  "id": "994yowjq4g",
  "type": "book",
  "title": "釋蟲小記",
  "work_id": "d59f2mrjw54w",
  "edition": "通藝錄本",
  "juan_count": {
    "number": 1,
    "unit": "卷"
  },
  "measure_info": "一卷",
  "indexed_by": [
    {
      "source": "中國古籍總目",
      "source_bid": "1exjosng9241s",
      "title_info": "釋蟲小記一卷",
      "summary": "釋蟲小記一卷｜清程瑤田撰｜通藝錄本｜"
    }
  ],
  "sources": [
    {
      "id": "k3dllkace65ls7xz",
      "name": "中國古籍總目（上圖聯合目錄）",
      "type": "url",
      "details": "https://gj.library.sh.cn/unionCatalogue/work/list#uri=http://data.library.sh.cn/gj/resource/instance/k3dllkace65ls7xz&from=evidence"
    }
  ],
  "ai_note": "F 道（overview#576）據《中國古籍總目》（上圖聯合目錄）自動錄入；源記錄：k3dllkace65ls7xz\n總目未載館藏",
  "revision": "1.0.0",
  "revised_at": "2026-10-21"
}
