{
  "schema_version": 1,
  "id": "994bqzvls1",
  "type": "book",
  "title": "趙客亭先生年譜紀畧",
  "work_id": "d59fysqsy6tc",
  "edition": "",
  "juan_count": {
    "number": 1,
    "unit": "卷"
  },
  "measure_info": "一卷",
  "provenance": [
    {
      "institution": "廣東省中山圖書館",
      "call_number": "",
      "seals": [],
      "notes": "",
      "source": "中國古籍總目 item/4kfnjjcpphpfcdf0"
    },
    {
      "institution": "遼寧省圖書館",
      "call_number": "",
      "seals": [],
      "notes": "",
      "source": "中國古籍總目 item/b66c6hv3k2cr80bu"
    },
    {
      "institution": "天津圖書館",
      "call_number": "",
      "seals": [],
      "notes": "",
      "source": "中國古籍總目 item/e8dtsjlyve1z5fq2"
    },
    {
      "institution": "國家圖書館",
      "call_number": "",
      "seals": [],
      "notes": "",
      "source": "中國古籍總目 item/gyqofnzgtfj0xpyt"
    },
    {
      "institution": "上海圖書館",
      "call_number": "",
      "seals": [],
      "notes": "",
      "source": "中國古籍總目 item/jy23o6tugluq2jjb"
    },
    {
      "institution": "北京大學圖書館",
      "call_number": "",
      "seals": [],
      "notes": "",
      "source": "中國古籍總目 item/p0c3hzhdp3wn4wjv"
    },
    {
      "institution": "南京圖書館",
      "call_number": "",
      "seals": [],
      "notes": "",
      "source": "中國古籍總目 item/q7ijqisjghsqinkb"
    },
    {
      "institution": "四川大學圖書館",
      "call_number": "",
      "seals": [],
      "notes": "",
      "source": "中國古籍總目 item/rz2effo0aeh141b5"
    },
    {
      "institution": "中國科學院圖書館",
      "call_number": "",
      "seals": [],
      "notes": "",
      "source": "中國古籍總目 item/u4ashb2smlfbo6ne"
    }
  ],
  "indexed_by": [
    {
      "source": "中國古籍總目",
      "source_bid": "1exjosng9241s",
      "title_info": "趙客亭先生（于京）年譜紀畧一卷",
      "summary": "趙客亭先生（于京）年譜紀畧一卷｜清呂元亮撰｜｜廣東省中山圖書館、遼寧省圖書館、天津圖書館、國家圖書館、上海圖書館、北京大學圖書館、南京圖書館、四川大學圖書館、中國科學院圖書館"
    }
  ],
  "sources": [
    {
      "id": "dw461ekjng7226xg",
      "name": "中國古籍總目（上圖聯合目錄）",
      "type": "url",
      "details": "https://gj.library.sh.cn/unionCatalogue/work/list#uri=http://data.library.sh.cn/gj/resource/instance/dw461ekjng7226xg&from=evidence"
    }
  ],
  "ai_note": "【叢書子目·挂既有Work】叢書线（GUJI-526）據《中國古籍總目》（上圖聯合目錄）自動錄入；源記錄：dw461ekjng7226xg",
  "contained_in": [
    {
      "id": "8rldon21ls76"
    }
  ],
  "revision": "1.0.0",
  "revised_at": "2026-10-20"
}
