{
  "schema_version": 1,
  "id": "98xwyw87pg",
  "type": "book",
  "title": "晉甎室詩存",
  "work_id": "d59fse1pxds3",
  "edition": "清同治五年刻本",
  "edition_type": "刻本",
  "measure_info": "四卷爨餘集一卷續詩存一卷",
  "publication_info": {
    "year": "1866"
  },
  "provenance": [
    {
      "institution": "北京大學圖書館",
      "call_number": "",
      "seals": [],
      "notes": "",
      "source": "中國古籍總目 item/d8uk6iwqtutcefk4"
    },
    {
      "institution": "中國科學院圖書館",
      "call_number": "",
      "seals": [],
      "notes": "",
      "source": "中國古籍總目 item/isihusljhnzmf2tt"
    }
  ],
  "indexed_by": [
    {
      "source": "中國古籍總目",
      "source_bid": "d59frnrt4lxc",
      "title_info": "晉甎室詩存四卷爨餘集一卷續詩存一卷",
      "summary": "晉甎室詩存四卷爨餘集一卷續詩存一卷｜清趙瑜撰｜清同治五年刻本｜北京大學圖書館、中國科學院圖書館"
    }
  ],
  "sources": [
    {
      "id": "vk631v3vl0ovsagv",
      "name": "中國古籍總目（上圖聯合目錄）",
      "type": "url",
      "details": "https://gj.library.sh.cn/unionCatalogue/work/list#uri=http://data.library.sh.cn/gj/resource/instance/vk631v3vl0ovsagv&from=evidence"
    }
  ],
  "ai_note": "E 道（overview#409）據《中國古籍總目》（上圖聯合目錄）自動錄入；源記錄：vk631v3vl0ovsagv\n責任者一致性：總目 contMap 與題名行 dclabel 在「dynasty」上不一致，取 contMap；題名行：清趙瑜撰",
  "revision": "1.0.0",
  "revised_at": "2026-10-09"
}
