{
  "schema_version": 1,
  "id": "993c1zm8sg",
  "type": "book",
  "title": "林氏眼科簡便驗方",
  "work_id": "d59fxt4t06bm",
  "edition": "清杭州簡青齋刻本",
  "edition_type": "刻本",
  "publication_info": {
    "year": "1909-1911",
    "details": "刊刻者：杭州簡青齋"
  },
  "provenance": [
    {
      "institution": "浙江省中醫藥研究院",
      "call_number": "",
      "seals": [],
      "notes": "",
      "source": "中國古籍總目 item/ouj7uv2zr6fas68f"
    }
  ],
  "indexed_by": [
    {
      "source": "中國古籍總目",
      "source_bid": "1exjosng9241s",
      "title_info": "林氏眼科簡便驗方",
      "summary": "林氏眼科簡便驗方｜清林士綸撰｜清杭州簡青齋刻本｜浙江省中醫藥研究院"
    }
  ],
  "sources": [
    {
      "id": "0fdgrlwp1bp4h0zo",
      "name": "中國古籍總目（上圖聯合目錄）",
      "type": "url",
      "details": "https://gj.library.sh.cn/unionCatalogue/work/list#uri=http://data.library.sh.cn/gj/resource/instance/0fdgrlwp1bp4h0zo&from=evidence"
    }
  ],
  "ai_note": "G 道（overview#576）據《中國古籍總目》（上圖聯合目錄）自動錄入；源記錄：0fdgrlwp1bp4h0zo",
  "revision": "1.0.0",
  "revised_at": "2026-10-18"
}
