{
  "schema_version": 1,
  "id": "9952u8cp34",
  "type": "book",
  "title": "粤東剿匪紀畧",
  "work_id": "d59f2nc9m2v5",
  "edition": "如不及齋叢書本",
  "juan_count": {
    "number": 5,
    "unit": "卷"
  },
  "measure_info": "五卷",
  "indexed_by": [
    {
      "source": "中國古籍總目",
      "source_bid": "1exjosng9241s",
      "title_info": "粤東剿匪紀畧五卷",
      "summary": "粤東剿匪紀畧五卷｜清陳坤撰｜如不及齋叢書本｜"
    }
  ],
  "sources": [
    {
      "id": "fewsv0c5tdk0zcwj",
      "name": "中國古籍總目（上圖聯合目錄）",
      "type": "url",
      "details": "https://gj.library.sh.cn/unionCatalogue/work/list#uri=http://data.library.sh.cn/gj/resource/instance/fewsv0c5tdk0zcwj&from=evidence"
    }
  ],
  "ai_note": "F 道（overview#576）據《中國古籍總目》（上圖聯合目錄）自動錄入；源記錄：fewsv0c5tdk0zcwj\n總目未載館藏",
  "revision": "1.0.0",
  "revised_at": "2026-10-21"
}
