{
  "schema_version": 1,
  "id": "994cd3ueww",
  "type": "book",
  "title": "絳帖平",
  "work_id": "d59f2hruy3nk",
  "edition": "",
  "measure_info": "六卷總錄一卷",
  "provenance": [
    {
      "institution": "上海圖書館",
      "call_number": "",
      "seals": [],
      "notes": "",
      "source": "中國古籍總目 item/116l4b8zzyhdaenh"
    },
    {
      "institution": "南京圖書館",
      "call_number": "",
      "seals": [],
      "notes": "",
      "source": "中國古籍總目 item/3fmrcmbab1fvylxs"
    },
    {
      "institution": "湖北省圖書館",
      "call_number": "",
      "seals": [],
      "notes": "",
      "source": "中國古籍總目 item/6szveka5r8c1m087"
    },
    {
      "institution": "遼寧省圖書館",
      "call_number": "",
      "seals": [],
      "notes": "",
      "source": "中國古籍總目 item/764mrvx33po1md15"
    },
    {
      "institution": "浙江圖書館",
      "call_number": "",
      "seals": [],
      "notes": "",
      "source": "中國古籍總目 item/erszflb2td4ua1p5"
    },
    {
      "institution": "四川省圖書館",
      "call_number": "",
      "seals": [],
      "notes": "",
      "source": "中國古籍總目 item/hqjhhthayyxy3jv4"
    },
    {
      "institution": "廣東省中山圖書館",
      "call_number": "",
      "seals": [],
      "notes": "",
      "source": "中國古籍總目 item/q12ma6sdugnppxv5"
    },
    {
      "institution": "國家圖書館",
      "call_number": "",
      "seals": [],
      "notes": "",
      "source": "中國古籍總目 item/sazeey6mcv807kkc"
    },
    {
      "institution": "青海省圖書館",
      "call_number": "",
      "seals": [],
      "notes": "",
      "source": "中國古籍總目 item/v6gflhwzundszozz"
    },
    {
      "institution": "天津圖書館",
      "call_number": "",
      "seals": [],
      "notes": "",
      "source": "中國古籍總目 item/zdaajsll3l7qf4so"
    }
  ],
  "indexed_by": [
    {
      "source": "中國古籍總目",
      "source_bid": "1exjosng9241s",
      "title_info": "絳帖平六卷總錄一卷",
      "summary": "絳帖平六卷總錄一卷｜宋姜夔撰｜｜上海圖書館、南京圖書館、湖北省圖書館、遼寧省圖書館、浙江圖書館、四川省圖書館、廣東省中山圖書館、國家圖書館、青海省圖書館、天津圖書館"
    }
  ],
  "sources": [
    {
      "id": "xr6rqm7ywxsauhd7",
      "name": "中國古籍總目（上圖聯合目錄）",
      "type": "url",
      "details": "https://gj.library.sh.cn/unionCatalogue/work/list#uri=http://data.library.sh.cn/gj/resource/instance/xr6rqm7ywxsauhd7&from=evidence"
    }
  ],
  "ai_note": "【叢書子目·挂既有Work】叢書线（GUJI-526）據《中國古籍總目》（上圖聯合目錄）自動錄入；源記錄：xr6rqm7ywxsauhd7",
  "contained_in": [
    {
      "id": "8rldonorf7cx"
    }
  ],
  "revision": "1.0.0",
  "revised_at": "2026-10-20"
}
