{
  "schema_version": 1,
  "id": "993qx36eww",
  "type": "book",
  "title": "佛說迦葉禁戒經",
  "work_id": "d59fy7zw93wg",
  "edition": "明永樂十八年至正統五年刻",
  "edition_type": "刻本",
  "juan_count": {
    "number": 1,
    "unit": "卷"
  },
  "measure_info": "一卷",
  "publication_info": {
    "year": "明永樂十八年至正統五年"
  },
  "indexed_by": [
    {
      "source": "中國古籍總目",
      "source_bid": "1exjosng9241s",
      "title_info": "佛說迦葉禁戒經一卷",
      "summary": "佛說迦葉禁戒經一卷｜南朝宋沮渠京聲譯｜明永樂十八年至正統五年刻｜"
    }
  ],
  "sources": [
    {
      "id": "tg3mwxdxobnrmjz4",
      "name": "中國古籍總目（上圖聯合目錄）",
      "type": "url",
      "details": "https://gj.library.sh.cn/unionCatalogue/work/list#uri=http://data.library.sh.cn/gj/resource/instance/tg3mwxdxobnrmjz4&from=evidence"
    }
  ],
  "ai_note": "G 道（overview#576）據《中國古籍總目》（上圖聯合目錄）自動錄入；源記錄：tg3mwxdxobnrmjz4\n總目未載館藏",
  "revision": "1.0.0",
  "revised_at": "2026-10-19"
}
