{
  "schema_version": 1,
  "id": "98xwtn2eit",
  "type": "book",
  "title": "畫竹草",
  "work_id": "d59fsdwgrklg",
  "edition": "民國三十年抄本",
  "edition_type": "抄本",
  "juan_count": {
    "number": 1,
    "unit": "卷"
  },
  "measure_info": "一卷",
  "publication_info": {
    "year": "1941"
  },
  "provenance": [
    {
      "institution": "雲南省圖書館",
      "call_number": "",
      "seals": [],
      "notes": "",
      "source": "中國古籍總目 item/744tcpn8om1bzzw6"
    }
  ],
  "indexed_by": [
    {
      "source": "中國古籍總目",
      "source_bid": "d59frnrt4lxc",
      "title_info": "畫竹草一卷",
      "summary": "畫竹草一卷｜黃萬春撰｜民國三十年抄本｜雲南省圖書館"
    }
  ],
  "sources": [
    {
      "id": "l73qz7fjazcf0ccm",
      "name": "中國古籍總目（上圖聯合目錄）",
      "type": "url",
      "details": "https://gj.library.sh.cn/unionCatalogue/work/list#uri=http://data.library.sh.cn/gj/resource/instance/l73qz7fjazcf0ccm&from=evidence"
    }
  ],
  "ai_note": "E 道（overview#409）據《中國古籍總目》（上圖聯合目錄）自動錄入；源記錄：l73qz7fjazcf0ccm",
  "revision": "1.0.0",
  "revised_at": "2026-10-09"
}
