{
  "schema_version": 1,
  "id": "993c127ugw",
  "type": "book",
  "title": "史伯平先生所著書六種",
  "work_id": "d59fxt3vls01",
  "edition": "稿本",
  "edition_type": "稿本",
  "provenance": [
    {
      "institution": "南充師範學校圖書館",
      "call_number": "",
      "seals": [],
      "notes": "",
      "source": "中國古籍總目 item/8nvzrhyxwh7a03lj"
    }
  ],
  "indexed_by": [
    {
      "source": "中國古籍總目",
      "source_bid": "1exjosng9241s",
      "title_info": "史伯平先生所著書六種",
      "summary": "史伯平先生所著書六種｜清史致準撰｜稿本｜南充師範學校圖書館"
    }
  ],
  "sources": [
    {
      "id": "115e2heeikvrml8u",
      "name": "中國古籍總目（上圖聯合目錄）",
      "type": "url",
      "details": "https://gj.library.sh.cn/unionCatalogue/work/list#uri=http://data.library.sh.cn/gj/resource/instance/115e2heeikvrml8u&from=evidence"
    }
  ],
  "ai_note": "G 道（overview#576）據《中國古籍總目》（上圖聯合目錄）自動錄入；源記錄：115e2heeikvrml8u",
  "revision": "1.0.0",
  "revised_at": "2026-10-18"
}
