{
  "schema_version": 1,
  "id": "98y15mwveo",
  "type": "book",
  "title": "萍蘿齋詩集",
  "work_id": "d59fsi8gasxy",
  "edition": "民國九年鉛印本",
  "edition_type": "鉛印本",
  "juan_count": {
    "number": 6,
    "unit": "卷"
  },
  "measure_info": "六卷",
  "publication_info": {
    "year": "1920"
  },
  "provenance": [
    {
      "institution": "湖南省圖書館",
      "call_number": "",
      "seals": [],
      "notes": "",
      "source": "中國古籍總目 item/8mtbukbfl7i25q6s"
    }
  ],
  "indexed_by": [
    {
      "source": "中國古籍總目",
      "source_bid": "d59frnrt4lxc",
      "title_info": "萍蘿齋詩集六卷",
      "summary": "萍蘿齋詩集六卷｜尹豫撰｜民國九年鉛印本｜湖南省圖書館"
    }
  ],
  "sources": [
    {
      "id": "8rdaqbmgayzk2rru",
      "name": "中國古籍總目（上圖聯合目錄）",
      "type": "url",
      "details": "https://gj.library.sh.cn/unionCatalogue/work/list#uri=http://data.library.sh.cn/gj/resource/instance/8rdaqbmgayzk2rru&from=evidence"
    }
  ],
  "ai_note": "E 道（overview#409）據《中國古籍總目》（上圖聯合目錄）自動錄入；源記錄：8rdaqbmgayzk2rru",
  "revision": "1.0.0",
  "revised_at": "2026-10-09"
}
