{
  "schema_version": 1,
  "id": "98xwx146wy",
  "type": "book",
  "title": "薦香遺稿",
  "work_id": "d59fsdzutczl",
  "edition": "清光緒四年彊學簃刻本",
  "edition_type": "刻本",
  "juan_count": {
    "number": 3,
    "unit": "卷"
  },
  "measure_info": "三卷",
  "publication_info": {
    "year": "1878",
    "details": "刊刻者：彊學簃"
  },
  "provenance": [
    {
      "institution": "廣東省中山圖書館",
      "call_number": "",
      "seals": [],
      "notes": "",
      "source": "中國古籍總目 item/6o6tvvm7rbj44cef"
    },
    {
      "institution": "復旦大學圖書館",
      "call_number": "",
      "seals": [],
      "notes": "",
      "source": "中國古籍總目 item/su0hxqdy4lf2kllo"
    }
  ],
  "indexed_by": [
    {
      "source": "中國古籍總目",
      "source_bid": "d59frnrt4lxc",
      "title_info": "薦香遺稿三卷",
      "summary": "薦香遺稿三卷｜清秦代馨撰｜清光緒四年彊學簃刻本｜廣東省中山圖書館、復旦大學圖書館"
    }
  ],
  "sources": [
    {
      "id": "ggaahnfjigeyzfkk",
      "name": "中國古籍總目（上圖聯合目錄）",
      "type": "url",
      "details": "https://gj.library.sh.cn/unionCatalogue/work/list#uri=http://data.library.sh.cn/gj/resource/instance/ggaahnfjigeyzfkk&from=evidence"
    }
  ],
  "ai_note": "E 道（overview#409）據《中國古籍總目》（上圖聯合目錄）自動錄入；源記錄：ggaahnfjigeyzfkk",
  "revision": "1.0.0",
  "revised_at": "2026-10-09"
}
