{
  "schema_version": 1,
  "id": "993aehnqps",
  "type": "book",
  "title": "鐫張蘇兩大家四書講義合參",
  "work_id": "d59fxrcljta8",
  "edition": "明崇禎六年刻本",
  "edition_type": "刻本",
  "measure_info": "二十卷（大學一卷中庸二卷論語十卷孟子七卷）",
  "publication_info": {
    "year": "1633"
  },
  "provenance": [
    {
      "institution": "中國科學院圖書館",
      "call_number": "",
      "seals": [],
      "notes": "",
      "source": "中國古籍總目 item/3r0pnywz6dixl6ct"
    }
  ],
  "indexed_by": [
    {
      "source": "中國古籍總目",
      "source_bid": "1exjosng9241s",
      "title_info": "鐫張蘇兩大家四書講義合參二十卷（大學一卷中庸二卷論語十卷孟子七卷）",
      "summary": "鐫張蘇兩大家四書講義合參二十卷（大學一卷中庸二卷論語十卷孟子七卷）｜明蔣方馨輯｜明崇禎六年刻本｜中國科學院圖書館"
    }
  ],
  "sources": [
    {
      "id": "fukljsg1e2al7ppi",
      "name": "中國古籍總目（上圖聯合目錄）",
      "type": "url",
      "details": "https://gj.library.sh.cn/unionCatalogue/work/list#uri=http://data.library.sh.cn/gj/resource/instance/fukljsg1e2al7ppi&from=evidence"
    }
  ],
  "ai_note": "F 道（overview#576）據《中國古籍總目》（上圖聯合目錄）自動錄入；源記錄：fukljsg1e2al7ppi",
  "revision": "1.0.0",
  "revised_at": "2026-10-18"
}
