{
  "schema_version": 1,
  "id": "993c0fqrcy",
  "type": "book",
  "title": "句股形邊角相求術圖解",
  "work_id": "d59fxt39fxfl",
  "edition": "清光緒三十二年安徽刻本",
  "edition_type": "刻本",
  "juan_count": {
    "number": 1,
    "unit": "卷"
  },
  "measure_info": "一卷",
  "publication_info": {
    "year": "1906",
    "details": "刊刻者：安徽"
  },
  "provenance": [
    {
      "institution": "國家圖書館",
      "call_number": "",
      "seals": [],
      "notes": "",
      "source": "中國古籍總目 item/cyodll4m8ep7wmxa"
    }
  ],
  "indexed_by": [
    {
      "source": "中國古籍總目",
      "source_bid": "1exjosng9241s",
      "title_info": "句股形邊角相求術圖解一卷",
      "summary": "句股形邊角相求術圖解一卷｜清項名達撰;清石振埏圖解｜清光緒三十二年安徽刻本｜國家圖書館"
    }
  ],
  "sources": [
    {
      "id": "x1nwwe6eyxtpbf27",
      "name": "中國古籍總目（上圖聯合目錄）",
      "type": "url",
      "details": "https://gj.library.sh.cn/unionCatalogue/work/list#uri=http://data.library.sh.cn/gj/resource/instance/x1nwwe6eyxtpbf27&from=evidence"
    }
  ],
  "ai_note": "G 道（overview#576）據《中國古籍總目》（上圖聯合目錄）自動錄入；源記錄：x1nwwe6eyxtpbf27",
  "revision": "1.0.0",
  "revised_at": "2026-10-18"
}
