{
  "schema_version": 1,
  "id": "994k4w7z7k",
  "type": "book",
  "title": "論語廣義",
  "work_id": "d59fz141kiyo",
  "edition": "",
  "provenance": [
    {
      "institution": "福建師範大學圖書館",
      "call_number": "",
      "seals": [],
      "notes": "",
      "source": "中國古籍總目 item/0a8n28rm45f88z5g"
    },
    {
      "institution": "國家圖書館",
      "call_number": "",
      "seals": [],
      "notes": "",
      "source": "中國古籍總目 item/pvlkkplefootz3sa"
    },
    {
      "institution": "中國科學院圖書館",
      "call_number": "",
      "seals": [],
      "notes": "",
      "source": "中國古籍總目 item/ss703j488etv6gqa"
    }
  ],
  "indexed_by": [
    {
      "source": "中國古籍總目",
      "source_bid": "d59frnrt4lxc",
      "title_info": "論語廣義",
      "summary": "論語廣義｜｜｜福建師範大學圖書館、國家圖書館、中國科學院圖書館"
    }
  ],
  "sources": [
    {
      "id": "5tgdtohcwqz410et",
      "name": "中國古籍總目（上圖聯合目錄）",
      "type": "url",
      "details": "https://gj.library.sh.cn/unionCatalogue/work/list#uri=http://data.library.sh.cn/gj/resource/instance/5tgdtohcwqz410et&from=evidence"
    }
  ],
  "ai_note": "【叢書子目新建·未比对到单行本】叢書线（GUJI-526）據《中國古籍總目》（上圖聯合目錄）自動錄入；源記錄：5tgdtohcwqz410et\nauto-split:存疑未并\n叢書子目，作者缺（同题既有 Work 作者缺，未硬并）\n叢書子目，卷數缺（總目未載卷數，Book 不填卷數）",
  "contained_in": [
    {
      "id": "8rldovghavb5"
    }
  ],
  "revision": "1.0.0",
  "revised_at": "2026-10-20"
}
