{
  "schema_version": 1,
  "id": "995a6gfa4g",
  "type": "book",
  "title": "世說新語補",
  "work_id": "d59fy1078ge8",
  "edition": "明刻本",
  "edition_type": "刻本",
  "measure_info": "二十卷附釋名一卷",
  "publication_info": {
    "year": "1368-1644"
  },
  "authors": [
    {
      "name": "劉義慶",
      "role": "撰",
      "dynasty": "南朝宋",
      "entity_id": "hixhd2h9bhs3"
    },
    {
      "name": "劉孝標",
      "role": "注",
      "dynasty": "梁"
    },
    {
      "name": "王世懋",
      "role": "批釋",
      "dynasty": "明"
    },
    {
      "name": "張文柱",
      "role": "校注",
      "dynasty": "明"
    },
    {
      "name": "王世貞",
      "role": "删定",
      "dynasty": "明"
    },
    {
      "name": "何良俊",
      "role": "增補",
      "dynasty": "明"
    }
  ],
  "provenance": [
    {
      "institution": "國家圖書館",
      "call_number": "",
      "seals": [],
      "notes": "",
      "source": "中國古籍總目 item/ppzrs70t6t4wf4z3"
    }
  ],
  "indexed_by": [
    {
      "source": "中國古籍總目",
      "source_bid": "d59frnrt4lxc",
      "title_info": "世說新語補二十卷附釋名一卷",
      "summary": "世說新語補二十卷附釋名一卷｜南朝宋劉義慶撰;梁劉孝標注;明何良俊增補;明王世貞删定;明王世懋批釋;明張文柱校注｜明刻本｜國家圖書館"
    }
  ],
  "sources": [
    {
      "id": "bbuvnkys5bgy2kph",
      "name": "中國古籍總目（上圖聯合目錄）",
      "type": "url",
      "details": "https://gj.library.sh.cn/unionCatalogue/work/list#uri=http://data.library.sh.cn/gj/resource/instance/bbuvnkys5bgy2kph&from=evidence"
    }
  ],
  "ai_note": "G 道（overview#576）據《中國古籍總目》（上圖聯合目錄）自動錄入；源記錄：bbuvnkys5bgy2kph\n責任者一致性：總目 contMap 與題名行 dclabel 在「dynasty」上不一致，取 contMap；題名行：南朝宋劉義慶撰;梁劉孝標注;明何良俊增補;明王世貞删定;明王世懋批釋;明張文柱校注",
  "revision": "1.0.0",
  "revised_at": "2026-10-21"
}
