{
  "schema_version": 1,
  "id": "994b0j7gu8",
  "type": "book",
  "title": "浙江海運全案重編初編",
  "work_id": "d59fyrnnamm8",
  "edition": "清同治六年刻本",
  "edition_type": "刻本",
  "measure_info": "八卷續編四卷新編八卷",
  "publication_info": {
    "year": "1867"
  },
  "provenance": [
    {
      "institution": "上海圖書館",
      "call_number": "",
      "seals": [],
      "notes": "",
      "source": "中國古籍總目 item/4gbbxqdf85mfduam"
    },
    {
      "institution": "浙江圖書館",
      "call_number": "",
      "seals": [],
      "notes": "",
      "source": "中國古籍總目 item/d5ai342feefgduj7"
    },
    {
      "institution": "國家圖書館",
      "call_number": "",
      "seals": [],
      "notes": "",
      "source": "中國古籍總目 item/kluvh67eoekxrkfs"
    }
  ],
  "indexed_by": [
    {
      "source": "中國古籍總目",
      "source_bid": "1exjosng9241s",
      "title_info": "浙江海運全案重編初編八卷續編四卷新編八卷",
      "summary": "浙江海運全案重編初編八卷續編四卷新編八卷｜清馬新貽修;清蔣益灃纂｜清同治六年刻本｜上海圖書館、浙江圖書館、國家圖書館"
    }
  ],
  "sources": [
    {
      "id": "qbu3hmpdrzslm35l",
      "name": "中國古籍總目（上圖聯合目錄）",
      "type": "url",
      "details": "https://gj.library.sh.cn/unionCatalogue/work/list#uri=http://data.library.sh.cn/gj/resource/instance/qbu3hmpdrzslm35l&from=evidence"
    }
  ],
  "ai_note": "F 道（overview#576）據《中國古籍總目》（上圖聯合目錄）自動錄入；源記錄：qbu3hmpdrzslm35l",
  "revision": "1.0.0",
  "revised_at": "2026-10-20"
}
