{
  "schema_version": 1,
  "id": "993w9kjfuo",
  "type": "book",
  "title": "雜劇段數",
  "work_id": "d59fybar64g0",
  "edition": "",
  "provenance": [
    {
      "institution": "中國科學院圖書館",
      "call_number": "",
      "seals": [],
      "notes": "說郛一百二十𢎥一千三百六十種（存一千二百三十七種）；存一千二百三十七種，續全缺",
      "source": "中國古籍總目 item/odeaxyqxd0xr6fc4"
    }
  ],
  "indexed_by": [
    {
      "source": "中國古籍總目",
      "source_bid": "1exjosng9241s",
      "title_info": "雜劇段數",
      "summary": "雜劇段數｜宋周密撰｜｜中國科學院圖書館"
    }
  ],
  "sources": [
    {
      "id": "gvjii0bphzl37xnl",
      "name": "中國古籍總目（上圖聯合目錄）",
      "type": "url",
      "details": "https://gj.library.sh.cn/unionCatalogue/work/list#uri=http://data.library.sh.cn/gj/resource/instance/gvjii0bphzl37xnl&from=evidence"
    }
  ],
  "ai_note": "【叢書子目·挂既有Work】叢書线（GUJI-526）據《中國古籍總目》（上圖聯合目錄）自動錄入；源記錄：gvjii0bphzl37xnl\n叢書子目，卷數缺（總目未載卷數，Book 不填卷數）",
  "contained_in": [
    {
      "id": "8rldo7hu2fwg"
    }
  ],
  "revision": "1.0.0",
  "revised_at": "2026-10-19"
}
