{
  "schema_version": 1,
  "id": "994bep98g0",
  "type": "book",
  "title": "遊玉簾泉記",
  "work_id": "d59fyruv02kg",
  "edition": "",
  "juan_count": {
    "number": 1,
    "unit": "卷"
  },
  "measure_info": "一卷",
  "provenance": [
    {
      "institution": "國家圖書館",
      "call_number": "",
      "seals": [],
      "notes": "",
      "source": "中國古籍總目 item/lcebk8p5uv4t1hrh"
    },
    {
      "institution": "中國科學院圖書館",
      "call_number": "",
      "seals": [],
      "notes": "",
      "source": "中國古籍總目 item/02n6rtuw88fvzonn"
    },
    {
      "institution": "復旦大學圖書館",
      "call_number": "",
      "seals": [],
      "notes": "",
      "source": "中國古籍總目 item/708h8onptrbeixax"
    },
    {
      "institution": "上海圖書館",
      "call_number": "",
      "seals": [],
      "notes": "",
      "source": "中國古籍總目 item/as4vuyvz2bvghfgs"
    },
    {
      "institution": "湖北省圖書館",
      "call_number": "",
      "seals": [],
      "notes": "",
      "source": "中國古籍總目 item/fu2lgzkpd68knia6"
    },
    {
      "institution": "天津圖書館",
      "call_number": "",
      "seals": [],
      "notes": "",
      "source": "中國古籍總目 item/o8rnetd0mkxaphf3"
    },
    {
      "institution": "國家圖書館",
      "call_number": "",
      "seals": [],
      "notes": "",
      "source": "中國古籍總目 item/pemtou4oyv0olfsr"
    },
    {
      "institution": "浙江圖書館",
      "call_number": "",
      "seals": [],
      "notes": "",
      "source": "中國古籍總目 item/qxh2qc57th140qfy"
    },
    {
      "institution": "山東省圖書館",
      "call_number": "",
      "seals": [],
      "notes": "",
      "source": "中國古籍總目 item/r6fb5a0uxfjsvg0l"
    },
    {
      "institution": "北京大學圖書館",
      "call_number": "",
      "seals": [],
      "notes": "",
      "source": "中國古籍總目 item/v642q44kh15g2o1k"
    },
    {
      "institution": "遼寧省圖書館",
      "call_number": "",
      "seals": [],
      "notes": "",
      "source": "中國古籍總目 item/wz5hz0eda0jefo27"
    },
    {
      "institution": "南京圖書館",
      "call_number": "",
      "seals": [],
      "notes": "",
      "source": "中國古籍總目 item/xrzr5u361dtfs5e3"
    }
  ],
  "indexed_by": [
    {
      "source": "中國古籍總目",
      "source_bid": "1exjosng9241s",
      "title_info": "遊玉簾泉記一卷",
      "summary": "遊玉簾泉記一卷｜清黃永年撰｜｜國家圖書館"
    }
  ],
  "sources": [
    {
      "id": "z20cwy7056rebgn2",
      "name": "中國古籍總目（上圖聯合目錄）",
      "type": "url",
      "details": "https://gj.library.sh.cn/unionCatalogue/work/list#uri=http://data.library.sh.cn/gj/resource/instance/z20cwy7056rebgn2&from=evidence"
    },
    {
      "id": "1mcf60ggiukofzgd",
      "name": "中國古籍總目（上圖聯合目錄）",
      "type": "url",
      "details": "https://gj.library.sh.cn/unionCatalogue/work/list#uri=http://data.library.sh.cn/gj/resource/instance/1mcf60ggiukofzgd&from=evidence"
    }
  ],
  "ai_note": "F 道（overview#576）據《中國古籍總目》（上圖聯合目錄）自動錄入；源記錄：z20cwy7056rebgn2、1mcf60ggiukofzgd",
  "revision": "1.0.0",
  "revised_at": "2026-10-20"
}
